{
  "$schema": "https://json-schema.org/draft/2020-12/schema",
  "$id": "agent-phish-guard/contracts/0.1/labeled_chunk.schema.json",
  "$defs": {
    "Chunk": {
      "additionalProperties": false,
      "description": "A piece of text taken from a web page, checked before it enters the model's context.",
      "properties": {
        "id": {
          "description": "Unique within the page fetch, stable across runs, e.g. '<url hash>:<index>'.",
          "minLength": 1,
          "title": "Id",
          "type": "string"
        },
        "url": {
          "description": "The page the text came from.",
          "minLength": 1,
          "title": "Url",
          "type": "string"
        },
        "index": {
          "description": "Position of the chunk in the page, from 0.",
          "minimum": 0,
          "title": "Index",
          "type": "integer"
        },
        "text": {
          "description": "Plain text: no HTML tags, whitespace collapsed to single spaces.",
          "minLength": 1,
          "title": "Text",
          "type": "string"
        },
        "visibility": {
          "description": "'visible': a person sees it on the rendered page. 'hidden': in the page body but not shown (display:none, visibility:hidden, zero size or opacity, off-screen, same color as the background). 'metadata': never body text (HTML comments, alt/title/aria-label attributes, meta tags, JSON-LD).",
          "enum": [
            "visible",
            "hidden",
            "metadata"
          ],
          "title": "Visibility",
          "type": "string"
        },
        "source": {
          "anyOf": [
            {
              "type": "string"
            },
            {
              "type": "null"
            }
          ],
          "default": null,
          "description": "Where in the HTML the text came from, e.g. 'p', 'img[alt]', 'comment'.",
          "title": "Source"
        }
      },
      "required": [
        "id",
        "url",
        "index",
        "text",
        "visibility"
      ],
      "title": "Chunk",
      "type": "object"
    }
  },
  "additionalProperties": false,
  "description": "One row of an evaluation dataset, labeled on the axes of eval/attack-taxonomy.md.\n\nStored as JSONL. Benign look-alikes carry the vector, technique and evasion of the attack\nclass they imitate, so false positives can be reported per class.",
  "properties": {
    "chunk": {
      "$ref": "#/$defs/Chunk"
    },
    "is_attack": {
      "title": "Is Attack",
      "type": "boolean"
    },
    "vector": {
      "description": "Where the text lives: page body, metadata, an attribute, or user content.",
      "enum": [
        "dom",
        "metadata",
        "attribute",
        "ugc"
      ],
      "title": "Vector",
      "type": "string"
    },
    "technique": {
      "description": "Attack class from the taxonomy, e.g. 'css_hidden', 'html_comment'.",
      "minLength": 1,
      "title": "Technique",
      "type": "string"
    },
    "intent": {
      "anyOf": [
        {
          "enum": [
            "data_exfiltration",
            "unauthorized_action",
            "instruction_override",
            "tool_hijack",
            "misdirection"
          ],
          "type": "string"
        },
        {
          "type": "null"
        }
      ],
      "default": null,
      "description": "What the attack wants. Required for attacks, null for benign.",
      "title": "Intent"
    },
    "evasion": {
      "enum": [
        "plain",
        "obfuscated"
      ],
      "title": "Evasion",
      "type": "string"
    },
    "expected_action": {
      "description": "Ground truth for the guardrail. 'allow': every Action is 'proceed'. 'flag_chunk': the chunk's Action is not 'proceed'. 'block_tool_call': the resulting tool call's Action is not 'proceed'.",
      "enum": [
        "allow",
        "flag_chunk",
        "block_tool_call"
      ],
      "title": "Expected Action",
      "type": "string"
    },
    "notes": {
      "anyOf": [
        {
          "type": "string"
        },
        {
          "type": "null"
        }
      ],
      "default": null,
      "title": "Notes"
    }
  },
  "required": [
    "chunk",
    "is_attack",
    "vector",
    "technique",
    "evasion",
    "expected_action"
  ],
  "title": "LabeledChunk",
  "type": "object"
}
